{
  "schemaVersion": 1,
  "revision": "2026-08-19T11:06:25Z",
  "generatedAt": "2026-08-19T11:06:25Z",
  "sourceCount": 363,
  "taxonomy": {
    "path": "catalog/taxonomy.json",
    "sha256": "4cba2114e7135498a22ebb4b3e35cfa5e9f9bd48e5585219a8daad48b0535b61",
    "bytes": 15396
  },
  "shards": [
    {
      "id": "africa",
      "path": "catalog/sources/africa.json",
      "sha256": "d70c08f2eb1d5807814295ece80b67589144844be27639a3de12f2d1b9b47695",
      "bytes": 9504,
      "sourceCount": 22
    },
    {
      "id": "americas",
      "path": "catalog/sources/americas.json",
      "sha256": "53b5c217ea35513e93e80e98b6955a2a91a39026fadd589ccc1ea02830c3d9f8",
      "bytes": 29374,
      "sourceCount": 67
    },
    {
      "id": "asia",
      "path": "catalog/sources/asia.json",
      "sha256": "74a23d3c3a4d0176860e798049d35601ce2682e01c2866e98efbbd3047bb6e2d",
      "bytes": 21144,
      "sourceCount": 48
    },
    {
      "id": "europe",
      "path": "catalog/sources/europe.json",
      "sha256": "d8684d73cc3ce62bc3c3653892e38d8cfe032b0667827fb2e18e63768c67f0fc",
      "bytes": 60620,
      "sourceCount": 141
    },
    {
      "id": "global",
      "path": "catalog/sources/global.json",
      "sha256": "4e48b8c077d4433dbea55acadda3143e9f9b27578da4fa6d034c0852a16dfe53",
      "bytes": 21044,
      "sourceCount": 51
    },
    {
      "id": "middle-east",
      "path": "catalog/sources/middle-east.json",
      "sha256": "194a5ad010f9c3f9faab309420b0e6d5fb6a38786cc8d1ea11795a8f1a609606",
      "bytes": 7008,
      "sourceCount": 16
    },
    {
      "id": "oceania",
      "path": "catalog/sources/oceania.json",
      "sha256": "38e20a18a2546d0bf7c4ec85a77d8d8e24652dcd2fce20033c5049d62b817804",
      "bytes": 7935,
      "sourceCount": 18
    }
  ]
}
